Leishmaniasis,Enfermedad parasitaria transmitida por la picadura de moscas de arena.,"Antimoniales pentavalentes, anfotericina B o miltefosina.","lceras cutneas, Prdida de peso, Fiebre prolongada, Inflamacin del hgado y bazo",0,,,,,,,,,,,,,,,,,,,,,,,,,,,,,,,,,,,,,,,,,,,,,,,,,,,,,,,,,,,,,,,,,,,,,,,,,,,,,,,,,,,,,,,,,,,,,,,,,,,,,,,,,,,,,,,,,,,,,,,,,,,,,,,,,,,,,,,,,,,,,,,,,,,,,,,,,,,,,,,,,,,,,,,,,,,,,,,,,,,,,,,,,,,,,,,,,,,,,,,,,,,,,,,,,,,,,,,,,,,,,,,,,,,,,,,,,
Enfermedad de Chagas,"Infeccin parasitaria causada por Trypanosoma cruzi, transmitida por insectos triatominos.",Benznidazol o nifurtimox en etapas tempranas.,"Fiebre prolongada, Hinchazn en el sitio de la picadura, Palpitaciones, Problemas digestivos en fases avanzadas",0,,,,,,,,,,,,,,,,,,,,,,,,,,,,,,,,,,,,,,,,,,,,,,,,,,,,,,,,,,,,,,,,,,,,,,,,,,,,,,,,,,,,,,,,,,,,,,,,,,,,,,,,,,,,,,,,,,,,,,,,,,,,,,,,,,,,,,,,,,,,,,,,,,,,,,,,,,,,,,,,,,,,,,,,,,,,,,,,,,,,,,,,,,,,,,,,,,,,,,,,,,,,,,,,,,,,,,,,,,,,,,,,,,,,,,,,,
Fiebre Q,"Infeccin bacteriana causada por Coxiella burnetii, que afecta pulmones e hgado.",Antibiticos (doxiciclina).,"Fiebre alta y repentina, Dolor muscular, Tos seca, Fatiga prolongada",0,,,,,,,,,,,,,,,,,,,,,,,,,,,,,,,,,,,,,,,,,,,,,,,,,,,,,,,,,,,,,,,,,,,,,,,,,,,,,,,,,,,,,,,,,,,,,,,,,,,,,,,,,,,,,,,,,,,,,,,,,,,,,,,,,,,,,,,,,,,,,,,,,,,,,,,,,,,,,,,,,,,,,,,,,,,,,,,,,,,,,,,,,,,,,,,,,,,,,,,,,,,,,,,,,,,,,,,,,,,,,,,,,,,,,,,,,
Actinomicosis,Infeccin bacteriana crnica que afecta piel y tejidos profundos.,Antibiticos prolongados (penicilina).,"Formacin de abscesos en la boca o mandbula, Dolor e hinchazn, Secrecin de pus, Fiebre intermitente",0,,,,,,,,,,,,,,,,,,,,,,,,,,,,,,,,,,,,,,,,,,,,,,,,,,,,,,,,,,,,,,,,,,,,,,,,,,,,,,,,,,,,,,,,,,,,,,,,,,,,,,,,,,,,,,,,,,,,,,,,,,,,,,,,,,,,,,,,,,,,,,,,,,,,,,,,,,,,,,,,,,,,,,,,,,,,,,,,,,,,,,,,,,,,,,,,,,,,,,,,,,,,,,,,,,,,,,,,,,,,,,,,,,,,,,,,,
Criptococosis,"Infeccin fngica que afecta los pulmones y el sistema nervioso central, comn en inmunodeprimidos.",Antifngicos (anfotericina B y fluconazol).,"Fiebre y escalofros, Dolor de cabeza intenso, Rigidez en el cuello, Problemas respiratorios en casos graves",0,,,,,,,,,,,,,,,,,,,,,,,,,,,,,,,,,,,,,,,,,,,,,,,,,,,,,,,,,,,,,,,,,,,,,,,,,,,,,,,,,,,,,,,,,,,,,,,,,,,,,,,,,,,,,,,,,,,,,,,,,,,,,,,,,,,,,,,,,,,,,,,,,,,,,,,,,,,,,,,,,,,,,,,,,,,,,,,,,,,,,,,,,,,,,,,,,,,,,,,,,,,,,,,,,,,,,,,,,,,,,,,,,,,,,,,,,
Parotiditis Viral (Paperas),Infeccin viral que causa inflamacin de las glndulas salivales.,Manejo sintomtico y vacunacin preventiva.,"Inflamacin dolorosa de las glndulas salivales, Fiebre, Dolor de cabeza, Prdida de apetito",0,,,,,,,,,,,,,,,,,,,,,,,,,,,,,,,,,,,,,,,,,,,,,,,,,,,,,,,,,,,,,,,,,,,,,,,,,,,,,,,,,,,,,,,,,,,,,,,,,,,,,,,,,,,,,,,,,,,,,,,,,,,,,,,,,,,,,,,,,,,,,,,,,,,,,,,,,,,,,,,,,,,,,,,,,,,,,,,,,,,,,,,,,,,,,,,,,,,,,,,,,,,,,,,,,,,,,,,,,,,,,,,,,,,,,,,,,
Infeccin por Virus del Nilo Occidental,Enfermedad viral transmitida por mosquitos que puede causar encefalitis.,"Manejo sintomtico, no hay tratamiento especfico.","Fiebre, Dolor muscular, Erupcin cutnea, Rigidez en el cuello en casos graves",0,,,,,,,,,,,,,,,,,,,,,,,,,,,,,,,,,,,,,,,,,,,,,,,,,,,,,,,,,,,,,,,,,,,,,,,,,,,,,,,,,,,,,,,,,,,,,,,,,,,,,,,,,,,,,,,,,,,,,,,,,,,,,,,,,,,,,,,,,,,,,,,,,,,,,,,,,,,,,,,,,,,,,,,,,,,,,,,,,,,,,,,,,,,,,,,,,,,,,,,,,,,,,,,,,,,,,,,,,,,,,,,,,,,,,,,,,
Infeccin por Parvovirus B19,Virus que causa la quinta enfermedad en nios y anemia en inmunodeprimidos.,Manejo sintomtico.,"Erupcin en las mejillas (""mejillas abofeteadas""), Fiebre leve, Dolor en las articulaciones, Fatiga",0,,,,,,,,,,,,,,,,,,,,,,,,,,,,,,,,,,,,,,,,,,,,,,,,,,,,,,,,,,,,,,,,,,,,,,,,,,,,,,,,,,,,,,,,,,,,,,,,,,,,,,,,,,,,,,,,,,,,,,,,,,,,,,,,,,,,,,,,,,,,,,,,,,,,,,,,,,,,,,,,,,,,,,,,,,,,,,,,,,,,,,,,,,,,,,,,,,,,,,,,,,,,,,,,,,,,,,,,,,,,,,,,,,,,,,,,,
Fibrosis Qustica,Enfermedad gentica que afecta los pulmones y el sistema digestivo debido a la produccin de moco espeso.,"Terapia respiratoria, antibiticos, enzimas pancreticas y moduladores CFTR.","Tos crnica con flemas, Dificultad para respirar, Infecciones pulmonares frecuentes, Problemas digestivos y desnutricin",0,,,,,,,,,,,,,,,,,,,,,,,,,,,,,,,,,,,,,,,,,,,,,,,,,,,,,,,,,,,,,,,,,,,,,,,,,,,,,,,,,,,,,,,,,,,,,,,,,,,,,,,,,,,,,,,,,,,,,,,,,,,,,,,,,,,,,,,,,,,,,,,,,,,,,,,,,,,,,,,,,,,,,,,,,,,,,,,,,,,,,,,,,,,,,,,,,,,,,,,,,,,,,,,,,,,,,,,,,,,,,,,,,,,,,,,,,
Bronquiolitis,"Infeccin viral en los bronquiolos, comn en bebs y nios pequeos.","Manejo sintomtico, oxigenoterapia en casos graves.","Sibilancias (sonido agudo al respirar), Tos persistente, Dificultad para respirar, Fiebre leve",0,,,,,,,,,,,,,,,,,,,,,,,,,,,,,,,,,,,,,,,,,,,,,,,,,,,,,,,,,,,,,,,,,,,,,,,,,,,,,,,,,,,,,,,,,,,,,,,,,,,,,,,,,,,,,,,,,,,,,,,,,,,,,,,,,,,,,,,,,,,,,,,,,,,,,,,,,,,,,,,,,,,,,,,,,,,,,,,,,,,,,,,,,,,,,,,,,,,,,,,,,,,,,,,,,,,,,,,,,,,,,,,,,,,,,,,,,
Hipertensin Pulmonar,"Aumento de la presin en las arterias pulmonares, lo que puede llevar a insuficiencia cardaca.","Vasodilatadores, anticoagulantes y trasplante pulmonar en casos graves.","Falta de aire, Fatiga, Mareos o desmayos, Dolor en el pecho",0,,,,,,,,,,,,,,,,,,,,,,,,,,,,,,,,,,,,,,,,,,,,,,,,,,,,,,,,,,,,,,,,,,,,,,,,,,,,,,,,,,,,,,,,,,,,,,,,,,,,,,,,,,,,,,,,,,,,,,,,,,,,,,,,,,,,,,,,,,,,,,,,,,,,,,,,,,,,,,,,,,,,,,,,,,,,,,,,,,,,,,,,,,,,,,,,,,,,,,,,,,,,,,,,,,,,,,,,,,,,,,,,,,,,,,,,,
Neumonitis,"Inflamacin del tejido pulmonar causada por infecciones, radiacin o reacciones autoinmunes.","Antibiticos, corticoides o supresin de la causa subyacente.","Tos seca, Fiebre, Fatiga extrema, Dificultad para respirar",0,,,,,,,,,,,,,,,,,,,,,,,,,,,,,,,,,,,,,,,,,,,,,,,,,,,,,,,,,,,,,,,,,,,,,,,,,,,,,,,,,,,,,,,,,,,,,,,,,,,,,,,,,,,,,,,,,,,,,,,,,,,,,,,,,,,,,,,,,,,,,,,,,,,,,,,,,,,,,,,,,,,,,,,,,,,,,,,,,,,,,,,,,,,,,,,,,,,,,,,,,,,,,,,,,,,,,,,,,,,,,,,,,,,,,,,,,
Aneurisma de Aorta,"Dilatacin anormal de la aorta, con riesgo de ruptura.","Control de presin arterial, ciruga en casos graves.","Dolor en el pecho o abdomen, Mareos o desmayos, Pulso acelerado; En casos graves, ruptura con sangrado interno",0,,,,,,,,,,,,,,,,,,,,,,,,,,,,,,,,,,,,,,,,,,,,,,,,,,,,,,,,,,,,,,,,,,,,,,,,,,,,,,,,,,,,,,,,,,,,,,,,,,,,,,,,,,,,,,,,,,,,,,,,,,,,,,,,,,,,,,,,,,,,,,,,,,,,,,,,,,,,,,,,,,,,,,,,,,,,,,,,,,,,,,,,,,,,,,,,,,,,,,,,,,,,,,,,,,,,,,,,,,,,,,,,,,,,,,,,,
Sndrome de QT Largo,Trastorno elctrico del corazn que puede causar arritmias peligrosas.,"Betabloqueantes, marcapasos o desfibrilador implantable.","Desmayos sbitos, Latidos irregulares, Mareos, Riesgo de muerte sbita",0,,,,,,,,,,,,,,,,,,,,,,,,,,,,,,,,,,,,,,,,,,,,,,,,,,,,,,,,,,,,,,,,,,,,,,,,,,,,,,,,,,,,,,,,,,,,,,,,,,,,,,,,,,,,,,,,,,,,,,,,,,,,,,,,,,,,,,,,,,,,,,,,,,,,,,,,,,,,,,,,,,,,,,,,,,,,,,,,,,,,,,,,,,,,,,,,,,,,,,,,,,,,,,,,,,,,,,,,,,,,,,,,,,,,,,,,,
Miocarditis,"Inflamacin del msculo cardaco, a menudo de origen viral.","Manejo sintomtico, inmunosupresores en casos autoinmunes.","Dolor en el pecho, Falta de aire, Fatiga extrema, Ritmo cardaco irregular",0,,,,,,,,,,,,,,,,,,,,,,,,,,,,,,,,,,,,,,,,,,,,,,,,,,,,,,,,,,,,,,,,,,,,,,,,,,,,,,,,,,,,,,,,,,,,,,,,,,,,,,,,,,,,,,,,,,,,,,,,,,,,,,,,,,,,,,,,,,,,,,,,,,,,,,,,,,,,,,,,,,,,,,,,,,,,,,,,,,,,,,,,,,,,,,,,,,,,,,,,,,,,,,,,,,,,,,,,,,,,,,,,,,,,,,,,,
Sndrome de Lennox-Gastaut,Epilepsia grave con mltiples tipos de convulsiones en nios.,"Antiepilpticos, dieta cetognica y estimulacin del nervio vago.","Convulsiones severas, Retraso en el desarrollo, Problemas de comportamiento, Dificultades para hablar",0,,,,,,,,,,,,,,,,,,,,,,,,,,,,,,,,,,,,,,,,,,,,,,,,,,,,,,,,,,,,,,,,,,,,,,,,,,,,,,,,,,,,,,,,,,,,,,,,,,,,,,,,,,,,,,,,,,,,,,,,,,,,,,,,,,,,,,,,,,,,,,,,,,,,,,,,,,,,,,,,,,,,,,,,,,,,,,,,,,,,,,,,,,,,,,,,,,,,,,,,,,,,,,,,,,,,,,,,,,,,,,,,,,,,,,,,,
Corea de Huntington,Trastorno neurodegenerativo hereditario que afecta el movimiento y la cognicin.,"Manejo sintomtico, terapia fsica y psicolgica.","Movimientos incontrolables, Cambios de humor y depresin, Prdida de memoria, Problemas para hablar y tragar",0,,,,,,,,,,,,,,,,,,,,,,,,,,,,,,,,,,,,,,,,,,,,,,,,,,,,,,,,,,,,,,,,,,,,,,,,,,,,,,,,,,,,,,,,,,,,,,,,,,,,,,,,,,,,,,,,,,,,,,,,,,,,,,,,,,,,,,,,,,,,,,,,,,,,,,,,,,,,,,,,,,,,,,,,,,,,,,,,,,,,,,,,,,,,,,,,,,,,,,,,,,,,,,,,,,,,,,,,,,,,,,,,,,,,,,,,,
Parlisis de Bell,Parlisis temporal de un lado de la cara debido a inflamacin del nervio facial.,"Corticoides, fisioterapia y, en algunos casos, antivirales.","Debilidad o parlisis en un lado de la cara, Dificultad para cerrar un ojo, Prdida de sensibilidad en el rostro, Dolor detrs del odo",0,,,,,,,,,,,,,,,,,,,,,,,,,,,,,,,,,,,,,,,,,,,,,,,,,,,,,,,,,,,,,,,,,,,,,,,,,,,,,,,,,,,,,,,,,,,,,,,,,,,,,,,,,,,,,,,,,,,,,,,,,,,,,,,,,,,,,,,,,,,,,,,,,,,,,,,,,,,,,,,,,,,,,,,,,,,,,,,,,,,,,,,,,,,,,,,,,,,,,,,,,,,,,,,,,,,,,,,,,,,,,,,,,,,,,,,,,
Sndrome de Wernicke-Korsakoff,"Trastorno neurolgico causado por deficiencia de vitamina B1, comn en alcohlicos crnicos.",Suplementacin con tiamina y manejo de sntomas neurolgicos.,"Confusin mental, Prdida de memoria, Falta de coordinacin, Problemas de visin",0,,,,,,,,,,,,,,,,,,,,,,,,,,,,,,,,,,,,,,,,,,,,,,,,,,,,,,,,,,,,,,,,,,,,,,,,,,,,,,,,,,,,,,,,,,,,,,,,,,,,,,,,,,,,,,,,,,,,,,,,,,,,,,,,,,,,,,,,,,,,,,,,,,,,,,,,,,,,,,,,,,,,,,,,,,,,,,,,,,,,,,,,,,,,,,,,,,,,,,,,,,,,,,,,,,,,,,,,,,,,,,,,,,,,,,,,,
Encefalopata Espongiforme (Enfermedad de Creutzfeldt-Jakob),Enfermedad prinica neurodegenerativa fatal.,"No hay cura, solo manejo sintomtico.","Prdida rpida de memoria, Movimientos musculares involuntarios, Confusin y desorientacin, Cambios de personalidad",0,,,,,,,,,,,,,,,,,,,,,,,,,,,,,,,,,,,,,,,,,,,,,,,,,,,,,,,,,,,,,,,,,,,,,,,,,,,,,,,,,,,,,,,,,,,,,,,,,,,,,,,,,,,,,,,,,,,,,,,,,,,,,,,,,,,,,,,,,,,,,,,,,,,,,,,,,,,,,,,,,,,,,,,,,,,,,,,,,,,,,,,,,,,,,,,,,,,,,,,,,,,,,,,,,,,,,,,,,,,,,,,,,,,,,,,,,
Gastroenteritis Viral,Inflamacin del estmago e intestinos causada por virus como rotavirus o norovirus.,"Hidratacin, manejo sintomtico.","Diarrea acuosa, Nuseas y vmitos, Dolor abdominal, Fiebre leve",0,,,,,,,,,,,,,,,,,,,,,,,,,,,,,,,,,,,,,,,,,,,,,,,,,,,,,,,,,,,,,,,,,,,,,,,,,,,,,,,,,,,,,,,,,,,,,,,,,,,,,,,,,,,,,,,,,,,,,,,,,,,,,,,,,,,,,,,,,,,,,,,,,,,,,,,,,,,,,,,,,,,,,,,,,,,,,,,,,,,,,,,,,,,,,,,,,,,,,,,,,,,,,,,,,,,,,,,,,,,,,,,,,,,,,,,,,
Sndrome de Intestino Corto,Dificultad para absorber nutrientes debido a la extirpacin quirrgica de parte del intestino.,"Nutricin parenteral, trasplante intestinal en casos graves.","Diarrea crnica, Prdida de peso, Fatiga extrema, Dficit de nutrientes",0,,,,,,,,,,,,,,,,,,,,,,,,,,,,,,,,,,,,,,,,,,,,,,,,,,,,,,,,,,,,,,,,,,,,,,,,,,,,,,,,,,,,,,,,,,,,,,,,,,,,,,,,,,,,,,,,,,,,,,,,,,,,,,,,,,,,,,,,,,,,,,,,,,,,,,,,,,,,,,,,,,,,,,,,,,,,,,,,,,,,,,,,,,,,,,,,,,,,,,,,,,,,,,,,,,,,,,,,,,,,,,,,,,,,,,,,,
Enfermedad Heptica Grasa No Alcohlica,Acumulacin de grasa en el hgado sin consumo excesivo de alcohol.,"Cambios en la dieta, ejercicio, control de enfermedades metablicas.","Fatiga, Dolor en la parte superior derecha del abdomen, Hepatomegalia (hgado agrandado), Posible cirrosis en etapas avanzadas",0,,,,,,,,,,,,,,,,,,,,,,,,,,,,,,,,,,,,,,,,,,,,,,,,,,,,,,,,,,,,,,,,,,,,,,,,,,,,,,,,,,,,,,,,,,,,,,,,,,,,,,,,,,,,,,,,,,,,,,,,,,,,,,,,,,,,,,,,,,,,,,,,,,,,,,,,,,,,,,,,,,,,,,,,,,,,,,,,,,,,,,,,,,,,,,,,,,,,,,,,,,,,,,,,,,,,,,,,,,,,,,,,,,,,,,,,,
Colangitis Esclerosante Primaria,Enfermedad inflamatoria de los conductos biliares.,"cido ursodesoxiclico, trasplante heptico en casos avanzados.","Picazn intensa en la piel, Fatiga extrema, Dolor en el abdomen superior derecho, Color amarillento en la piel y ojos",0,,,,,,,,,,,,,,,,,,,,,,,,,,,,,,,,,,,,,,,,,,,,,,,,,,,,,,,,,,,,,,,,,,,,,,,,,,,,,,,,,,,,,,,,,,,,,,,,,,,,,,,,,,,,,,,,,,,,,,,,,,,,,,,,,,,,,,,,,,,,,,,,,,,,,,,,,,,,,,,,,,,,,,,,,,,,,,,,,,,,,,,,,,,,,,,,,,,,,,,,,,,,,,,,,,,,,,,,,,,,,,,,,,,,,,,,,
Esofagitis Eosinoflica,Inflamacin del esfago causada por alergias alimentarias.,"Dieta de eliminacin, corticoides tpicos.","Dificultad para tragar, Dolor en el pecho, Acidez persistente, Sensacin de comida atorada en la garganta",0,,,,,,,,,,,,,,,,,,,,,,,,,,,,,,,,,,,,,,,,,,,,,,,,,,,,,,,,,,,,,,,,,,,,,,,,,,,,,,,,,,,,,,,,,,,,,,,,,,,,,,,,,,,,,,,,,,,,,,,,,,,,,,,,,,,,,,,,,,,,,,,,,,,,,,,,,,,,,,,,,,,,,,,,,,,,,,,,,,,,,,,,,,,,,,,,,,,,,,,,,,,,,,,,,,,,,,,,,,,,,,,,,,,,,,,,,
Diabetes Tipo 1,Enfermedad autoinmune en la que el cuerpo no produce insulina.,"Inyecciones de insulina, control estricto de la glucosa.","Sed excesiva, Prdida de peso repentina, Necesidad frecuente de orinar, Fatiga extrema",0,,,,,,,,,,,,,,,,,,,,,,,,,,,,,,,,,,,,,,,,,,,,,,,,,,,,,,,,,,,,,,,,,,,,,,,,,,,,,,,,,,,,,,,,,,,,,,,,,,,,,,,,,,,,,,,,,,,,,,,,,,,,,,,,,,,,,,,,,,,,,,,,,,,,,,,,,,,,,,,,,,,,,,,,,,,,,,,,,,,,,,,,,,,,,,,,,,,,,,,,,,,,,,,,,,,,,,,,,,,,,,,,,,,,,,,,,
Sndrome de Turner,Trastorno gentico en mujeres causado por la ausencia parcial o total de un cromosoma X.,"Terapia hormonal, apoyo en el crecimiento y fertilidad.","Baja estatura, Infertilidad, Problemas cardacos, Retrasos en el desarrollo",0,,,,,,,,,,,,,,,,,,,,,,,,,,,,,,,,,,,,,,,,,,,,,,,,,,,,,,,,,,,,,,,,,,,,,,,,,,,,,,,,,,,,,,,,,,,,,,,,,,,,,,,,,,,,,,,,,,,,,,,,,,,,,,,,,,,,,,,,,,,,,,,,,,,,,,,,,,,,,,,,,,,,,,,,,,,,,,,,,,,,,,,,,,,,,,,,,,,,,,,,,,,,,,,,,,,,,,,,,,,,,,,,,,,,,,,,,
Sndrome de Klinefelter,Trastorno gentico en hombres causado por la presencia de un cromosoma X extra.,Terapia de reemplazo de testosterona.,"Falta de desarrollo muscular, Infertilidad, Ginecomastia (crecimiento de senos en hombres), Baja produccin de testosterona",0,,,,,,,,,,,,,,,,,,,,,,,,,,,,,,,,,,,,,,,,,,,,,,,,,,,,,,,,,,,,,,,,,,,,,,,,,,,,,,,,,,,,,,,,,,,,,,,,,,,,,,,,,,,,,,,,,,,,,,,,,,,,,,,,,,,,,,,,,,,,,,,,,,,,,,,,,,,,,,,,,,,,,,,,,,,,,,,,,,,,,,,,,,,,,,,,,,,,,,,,,,,,,,,,,,,,,,,,,,,,,,,,,,,,,,,,,
Hipoglucemia Reactiva,"Bajada de azcar en sangre tras comer, debido a una produccin excesiva de insulina.","Dieta ajustada en carbohidratos, fraccionamiento de comidas.","Mareos y desmayos, Sudoracin excesiva, Hambre extrema, Confusin mental",0,,,,,,,,,,,,,,,,,,,,,,,,,,,,,,,,,,,,,,,,,,,,,,,,,,,,,,,,,,,,,,,,,,,,,,,,,,,,,,,,,,,,,,,,,,,,,,,,,,,,,,,,,,,,,,,,,,,,,,,,,,,,,,,,,,,,,,,,,,,,,,,,,,,,,,,,,,,,,,,,,,,,,,,,,,,,,,,,,,,,,,,,,,,,,,,,,,,,,,,,,,,,,,,,,,,,,,,,,,,,,,,,,,,,,,,,,
Queloides,Cicatrices hipertrficas que crecen ms all de la herida original.,"Inyecciones de corticoides, crioterapia, ciruga en casos graves.","Cicatrices gruesas y elevadas, Picazn o sensibilidad, Crecimiento ms all de la herida original, Puede ser de color rosado o rojizo",0,,,,,,,,,,,,,,,,,,,,,,,,,,,,,,,,,,,,,,,,,,,,,,,,,,,,,,,,,,,,,,,,,,,,,,,,,,,,,,,,,,,,,,,,,,,,,,,,,,,,,,,,,,,,,,,,,,,,,,,,,,,,,,,,,,,,,,,,,,,,,,,,,,,,,,,,,,,,,,,,,,,,,,,,,,,,,,,,,,,,,,,,,,,,,,,,,,,,,,,,,,,,,,,,,,,,,,,,,,,,,,,,,,,,,,,,,
Pitiriasis Rosada,Erupcin cutnea benigna con lesiones en forma de medalln.,"Manejo sintomtico, antihistamnicos para la picazn.","Erupcin en forma de parches rosados, Picazn leve, Puede extenderse al torso y extremidades, Generalmente autolimitada",0,,,,,,,,,,,,,,,,,,,,,,,,,,,,,,,,,,,,,,,,,,,,,,,,,,,,,,,,,,,,,,,,,,,,,,,,,,,,,,,,,,,,,,,,,,,,,,,,,,,,,,,,,,,,,,,,,,,,,,,,,,,,,,,,,,,,,,,,,,,,,,,,,,,,,,,,,,,,,,,,,,,,,,,,,,,,,,,,,,,,,,,,,,,,,,,,,,,,,,,,,,,,,,,,,,,,,,,,,,,,,,,,,,,,,,,,,
Sndrome de Stevens-Johnson,"Reaccin grave de la piel y mucosas, generalmente inducida por medicamentos.","Hospitalizacin, manejo del dolor y fluidos intravenosos.","Ampollas en la piel y mucosas, Fiebre alta, Dolor en la piel, Cada de la piel en casos graves",0,,,,,,,,,,,,,,,,,,,,,,,,,,,,,,,,,,,,,,,,,,,,,,,,,,,,,,,,,,,,,,,,,,,,,,,,,,,,,,,,,,,,,,,,,,,,,,,,,,,,,,,,,,,,,,,,,,,,,,,,,,,,,,,,,,,,,,,,,,,,,,,,,,,,,,,,,,,,,,,,,,,,,,,,,,,,,,,,,,,,,,,,,,,,,,,,,,,,,,,,,,,,,,,,,,,,,,,,,,,,,,,,,,,,,,,,,
Liquen Plano,Enfermedad inflamatoria de la piel y mucosas.,"Corticoides tpicos, antihistamnicos.","Lesiones moradas y planas en la piel, Picazn intensa, Afectacin en uas y cuero cabelludo, Posibles llagas en la boca",0,,,,,,,,,,,,,,,,,,,,,,,,,,,,,,,,,,,,,,,,,,,,,,,,,,,,,,,,,,,,,,,,,,,,,,,,,,,,,,,,,,,,,,,,,,,,,,,,,,,,,,,,,,,,,,,,,,,,,,,,,,,,,,,,,,,,,,,,,,,,,,,,,,,,,,,,,,,,,,,,,,,,,,,,,,,,,,,,,,,,,,,,,,,,,,,,,,,,,,,,,,,,,,,,,,,,,,,,,,,,,,,,,,,,,,,,,
Carcinoma Basocelular,Tipo de cncer de piel ms comn y de crecimiento lento.,"Ciruga, terapia con lser, crioterapia.","Bultos perlados en la piel, Llagas que no cicatrizan, Sangrado espontneo, Puede ulcerarse con el tiempo",0,,,,,,,,,,,,,,,,,,,,,,,,,,,,,,,,,,,,,,,,,,,,,,,,,,,,,,,,,,,,,,,,,,,,,,,,,,,,,,,,,,,,,,,,,,,,,,,,,,,,,,,,,,,,,,,,,,,,,,,,,,,,,,,,,,,,,,,,,,,,,,,,,,,,,,,,,,,,,,,,,,,,,,,,,,,,,,,,,,,,,,,,,,,,,,,,,,,,,,,,,,,,,,,,,,,,,,,,,,,,,,,,,,,,,,,,,
Trastorno Esquizoafectivo,Combinacin de sntomas de esquizofrenia y trastornos del estado de nimo.,"Antipsicticos, estabilizadores del nimo, terapia psicolgica.","Alucinaciones y delirios, Cambios de humor extremos, Problemas de concentracin, Aislamiento social",0,,,,,,,,,,,,,,,,,,,,,,,,,,,,,,,,,,,,,,,,,,,,,,,,,,,,,,,,,,,,,,,,,,,,,,,,,,,,,,,,,,,,,,,,,,,,,,,,,,,,,,,,,,,,,,,,,,,,,,,,,,,,,,,,,,,,,,,,,,,,,,,,,,,,,,,,,,,,,,,,,,,,,,,,,,,,,,,,,,,,,,,,,,,,,,,,,,,,,,,,,,,,,,,,,,,,,,,,,,,,,,,,,,,,,,,,,
Trastorno de Conversin,"Sntomas neurolgicos sin causa fsica evidente, asociados a estrs o trauma.","Terapia psicolgica, fisioterapia.","Prdida de funcin motora o sensorial sin causa fsica, Parlisis o dificultad para caminar, Ceguera o sordera repentina, Problemas del habla",0,,,,,,,,,,,,,,,,,,,,,,,,,,,,,,,,,,,,,,,,,,,,,,,,,,,,,,,,,,,,,,,,,,,,,,,,,,,,,,,,,,,,,,,,,,,,,,,,,,,,,,,,,,,,,,,,,,,,,,,,,,,,,,,,,,,,,,,,,,,,,,,,,,,,,,,,,,,,,,,,,,,,,,,,,,,,,,,,,,,,,,,,,,,,,,,,,,,,,,,,,,,,,,,,,,,,,,,,,,,,,,,,,,,,,,,,,
Sndrome de Capgras,Trastorno en el que la persona cree que alguien cercano ha sido reemplazado por un impostor.,"Terapia psicolgica, antipsicticos.","Creencia de que personas cercanas han sido reemplazadas por impostores, Ansiedad extrema, Aislamiento social, Desconfianza",0,,,,,,,,,,,,,,,,,,,,,,,,,,,,,,,,,,,,,,,,,,,,,,,,,,,,,,,,,,,,,,,,,,,,,,,,,,,,,,,,,,,,,,,,,,,,,,,,,,,,,,,,,,,,,,,,,,,,,,,,,,,,,,,,,,,,,,,,,,,,,,,,,,,,,,,,,,,,,,,,,,,,,,,,,,,,,,,,,,,,,,,,,,,,,,,,,,,,,,,,,,,,,,,,,,,,,,,,,,,,,,,,,,,,,,,,,
Trastorno de la Personalidad Antisocial,Patrn persistente de desprecio por los derechos de los dems.,"Psicoterapia, en algunos casos estabilizadores del estado de nimo.","Falta de empata, Conducta manipuladora, Impulsividad, Violacin de normas y reglas sociales",0,,,,,,,,,,,,,,,,,,,,,,,,,,,,,,,,,,,,,,,,,,,,,,,,,,,,,,,,,,,,,,,,,,,,,,,,,,,,,,,,,,,,,,,,,,,,,,,,,,,,,,,,,,,,,,,,,,,,,,,,,,,,,,,,,,,,,,,,,,,,,,,,,,,,,,,,,,,,,,,,,,,,,,,,,,,,,,,,,,,,,,,,,,,,,,,,,,,,,,,,,,,,,,,,,,,,,,,,,,,,,,,,,,,,,,,,,
Fobia Social,Trastorno de ansiedad caracterizado por miedo intenso a situaciones sociales.,"Terapia cognitivo-conductual, ansiolticos o antidepresivos en casos graves.","Miedo intenso a situaciones sociales, sudoracin excesiva, temblores, palpitaciones, nuseas ,dificultad para hablar en pblico",0,,,,,,,,,,,,,,,,,,,,,,,,,,,,,,,,,,,,,,,,,,,,,,,,,,,,,,,,,,,,,,,,,,,,,,,,,,,,,,,,,,,,,,,,,,,,,,,,,,,,,,,,,,,,,,,,,,,,,,,,,,,,,,,,,,,,,,,,,,,,,,,,,,,,,,,,,,,,,,,,,,,,,,,,,,,,,,,,,,,,,,,,,,,,,,,,,,,,,,,,,,,,,,,,,,,,,,,,,,,,,,,,,,,,,,,,,
Sndrome del Tnel Carpiano,"Compresin del nervio mediano en la mueca, causando hormigueo y debilidad en la mano.","Frulas, antiinflamatorios, ciruga en casos severos.","Hormigueo y entumecimiento en los dedos (pulgar, ndice, medio), dolor en la mueca y mano, debilidad en la mano, dificultad para sostener objetos",0,,,,,,,,,,,,,,,,,,,,,,,,,,,,,,,,,,,,,,,,,,,,,,,,,,,,,,,,,,,,,,,,,,,,,,,,,,,,,,,,,,,,,,,,,,,,,,,,,,,,,,,,,,,,,,,,,,,,,,,,,,,,,,,,,,,,,,,,,,,,,,,,,,,,,,,,,,,,,,,,,,,,,,,,,,,,,,,,,,,,,,,,,,,,,,,,,,,,,,,,,,,,,,,,,,,,,,,,,,,,,,,,,,,,,,,,,
Distrofia Muscular de Duchenne,Enfermedad gentica que causa debilitamiento muscular progresivo.,"Fisioterapia, corticosteroides, terapia gnica en investigacin.","Debilidad muscular progresiva, problemas para caminar, cadas frecuentes, dificultad para subir escaleras",0,,,,,,,,,,,,,,,,,,,,,,,,,,,,,,,,,,,,,,,,,,,,,,,,,,,,,,,,,,,,,,,,,,,,,,,,,,,,,,,,,,,,,,,,,,,,,,,,,,,,,,,,,,,,,,,,,,,,,,,,,,,,,,,,,,,,,,,,,,,,,,,,,,,,,,,,,,,,,,,,,,,,,,,,,,,,,,,,,,,,,,,,,,,,,,,,,,,,,,,,,,,,,,,,,,,,,,,,,,,,,,,,,,,,,,,,,
Espondilitis Anquilosante,Enfermedad inflamatoria crnica que afecta la columna vertebral.,"Antiinflamatorios, terapia fsica, biolgicos en casos avanzados.","Dolor y rigidez en la espalda baja, inflamacin de las articulaciones, fatiga, postura encorvada en casos avanzados",0,,,,,,,,,,,,,,,,,,,,,,,,,,,,,,,,,,,,,,,,,,,,,,,,,,,,,,,,,,,,,,,,,,,,,,,,,,,,,,,,,,,,,,,,,,,,,,,,,,,,,,,,,,,,,,,,,,,,,,,,,,,,,,,,,,,,,,,,,,,,,,,,,,,,,,,,,,,,,,,,,,,,,,,,,,,,,,,,,,,,,,,,,,,,,,,,,,,,,,,,,,,,,,,,,,,,,,,,,,,,,,,,,,,,,,,,,
Miopatas Inflamatorias,Grupo de enfermedades autoinmunes que provocan inflamacin muscular.,"Corticoides, inmunosupresores, fisioterapia.","Debilidad muscular progresiva; dificultad para levantarse, subir escaleras o levantar objetos; Dolor muscular; Fatiga",0,,,,,,,,,,,,,,,,,,,,,,,,,,,,,,,,,,,,,,,,,,,,,,,,,,,,,,,,,,,,,,,,,,,,,,,,,,,,,,,,,,,,,,,,,,,,,,,,,,,,,,,,,,,,,,,,,,,,,,,,,,,,,,,,,,,,,,,,,,,,,,,,,,,,,,,,,,,,,,,,,,,,,,,,,,,,,,,,,,,,,,,,,,,,,,,,,,,,,,,,,,,,,,,,,,,,,,,,,,,,,,,,,,,,,,,,,
Sndrome de Ehlers-Danlos,Trastorno del tejido conectivo que causa hiperflexibilidad y fragilidad en la piel.,"Terapia fsica, manejo del dolor, evitar lesiones.","Hiperelasticidad en la piel, hipermovilidad articular, dolor crnico, fragilidad en la piel.",0,,,,,,,,,,,,,,,,,,,,,,,,,,,,,,,,,,,,,,,,,,,,,,,,,,,,,,,,,,,,,,,,,,,,,,,,,,,,,,,,,,,,,,,,,,,,,,,,,,,,,,,,,,,,,,,,,,,,,,,,,,,,,,,,,,,,,,,,,,,,,,,,,,,,,,,,,,,,,,,,,,,,,,,,,,,,,,,,,,,,,,,,,,,,,,,,,,,,,,,,,,,,,,,,,,,,,,,,,,,,,,,,,,,,,,,,,
Linfedema,Hinchazn crnica en extremidades por acumulacin de lquido linftico.,"Drenaje linftico, compresin, ejercicio.","Hinchazn en brazos o piernas, sensacin de pesadez, piel tensa o dura, infecciones frecuentes en la zona afectada",0,,,,,,,,,,,,,,,,,,,,,,,,,,,,,,,,,,,,,,,,,,,,,,,,,,,,,,,,,,,,,,,,,,,,,,,,,,,,,,,,,,,,,,,,,,,,,,,,,,,,,,,,,,,,,,,,,,,,,,,,,,,,,,,,,,,,,,,,,,,,,,,,,,,,,,,,,,,,,,,,,,,,,,,,,,,,,,,,,,,,,,,,,,,,,,,,,,,,,,,,,,,,,,,,,,,,,,,,,,,,,,,,,,,,,,,,,
Prpura Trombocitopnica Idioptica,"Enfermedad autoinmune que destruye las plaquetas, causando sangrados.","Corticoides, inmunoglobulinas, esplenectoma en casos graves.","Aparicin de moretones sin causa aparente, Sangrado de encas o nariz, Sangrados prolongados, Pequeas manchas rojas en la piel (petequias)",0,,,,,,,,,,,,,,,,,,,,,,,,,,,,,,,,,,,,,,,,,,,,,,,,,,,,,,,,,,,,,,,,,,,,,,,,,,,,,,,,,,,,,,,,,,,,,,,,,,,,,,,,,,,,,,,,,,,,,,,,,,,,,,,,,,,,,,,,,,,,,,,,,,,,,,,,,,,,,,,,,,,,,,,,,,,,,,,,,,,,,,,,,,,,,,,,,,,,,,,,,,,,,,,,,,,,,,,,,,,,,,,,,,,,,,,,,
Talasemia,Trastorno gentico que afecta la produccin de hemoglobina.,"Transfusiones de sangre, terapia con hierro, trasplante de mdula sea en casos graves.","Fatiga, Palidez, Ictericia, Problemas seos, Dificultad para respirar",0,,,,,,,,,,,,,,,,,,,,,,,,,,,,,,,,,,,,,,,,,,,,,,,,,,,,,,,,,,,,,,,,,,,,,,,,,,,,,,,,,,,,,,,,,,,,,,,,,,,,,,,,,,,,,,,,,,,,,,,,,,,,,,,,,,,,,,,,,,,,,,,,,,,,,,,,,,,,,,,,,,,,,,,,,,,,,,,,,,,,,,,,,,,,,,,,,,,,,,,,,,,,,,,,,,,,,,,,,,,,,,,,,,,,,,,,,
Sndrome de Evans,Trastorno autoinmune en el que el sistema inmune ataca plaquetas y glbulos rojos.,"Corticoides, inmunosupresores.","Fatiga, Palidez, Sangrado excesivo, Infecciones frecuentes",0,,,,,,,,,,,,,,,,,,,,,,,,,,,,,,,,,,,,,,,,,,,,,,,,,,,,,,,,,,,,,,,,,,,,,,,,,,,,,,,,,,,,,,,,,,,,,,,,,,,,,,,,,,,,,,,,,,,,,,,,,,,,,,,,,,,,,,,,,,,,,,,,,,,,,,,,,,,,,,,,,,,,,,,,,,,,,,,,,,,,,,,,,,,,,,,,,,,,,,,,,,,,,,,,,,,,,,,,,,,,,,,,,,,,,,,,,
Histiocitosis de Clulas de Langerhans,Enfermedad rara en la que los histiocitos proliferan anormalmente y afectan rganos.,"Quimioterapia, corticoides.","Fiebre, Dolor seo, Erupciones cutneas, Ganglios linfticos inflamados",0,,,,,,,,,,,,,,,,,,,,,,,,,,,,,,,,,,,,,,,,,,,,,,,,,,,,,,,,,,,,,,,,,,,,,,,,,,,,,,,,,,,,,,,,,,,,,,,,,,,,,,,,,,,,,,,,,,,,,,,,,,,,,,,,,,,,,,,,,,,,,,,,,,,,,,,,,,,,,,,,,,,,,,,,,,,,,,,,,,,,,,,,,,,,,,,,,,,,,,,,,,,,,,,,,,,,,,,,,,,,,,,,,,,,,,,,,
Retinitis Pigmentosa,Enfermedad gentica que causa prdida progresiva de la visin.,"No hay cura, pero suplementos de vitamina A y terapia gnica pueden ayudar.","Prdida progresiva de la visin nocturna, Visin en tnel, Dificultad para adaptarse a la oscuridad",0,,,,,,,,,,,,,,,,,,,,,,,,,,,,,,,,,,,,,,,,,,,,,,,,,,,,,,,,,,,,,,,,,,,,,,,,,,,,,,,,,,,,,,,,,,,,,,,,,,,,,,,,,,,,,,,,,,,,,,,,,,,,,,,,,,,,,,,,,,,,,,,,,,,,,,,,,,,,,,,,,,,,,,,,,,,,,,,,,,,,,,,,,,,,,,,,,,,,,,,,,,,,,,,,,,,,,,,,,,,,,,,,,,,,,,,,,
Uvetis,"Inflamacin de la vea en el ojo, que puede causar prdida de visin.","Corticoides, inmunosupresores en casos graves.","Dolor ocular, Ojos rojos, Sensibilidad a la luz, Visin borrosa",0,,,,,,,,,,,,,,,,,,,,,,,,,,,,,,,,,,,,,,,,,,,,,,,,,,,,,,,,,,,,,,,,,,,,,,,,,,,,,,,,,,,,,,,,,,,,,,,,,,,,,,,,,,,,,,,,,,,,,,,,,,,,,,,,,,,,,,,,,,,,,,,,,,,,,,,,,,,,,,,,,,,,,,,,,,,,,,,,,,,,,,,,,,,,,,,,,,,,,,,,,,,,,,,,,,,,,,,,,,,,,,,,,,,,,,,,,
Degeneracin Macular Asociada a la Edad,Enfermedad ocular que causa prdida de visin central.,"Suplementos vitamnicos, inyecciones intravtreas.","Prdida de visin central, Dificultad para leer o reconocer caras, Visin borrosa",0,,,,,,,,,,,,,,,,,,,,,,,,,,,,,,,,,,,,,,,,,,,,,,,,,,,,,,,,,,,,,,,,,,,,,,,,,,,,,,,,,,,,,,,,,,,,,,,,,,,,,,,,,,,,,,,,,,,,,,,,,,,,,,,,,,,,,,,,,,,,,,,,,,,,,,,,,,,,,,,,,,,,,,,,,,,,,,,,,,,,,,,,,,,,,,,,,,,,,,,,,,,,,,,,,,,,,,,,,,,,,,,,,,,,,,,,,
Ojo Seco Crnico,"Falta de lubricacin en la superficie ocular, causando irritacin y visin borrosa.","Lgrimas artificiales, suero autlogo, cambios en la dieta.","Sensacin de arenilla en los ojos, Ardor, Ojos llorosos, Visin borrosa",0,,,,,,,,,,,,,,,,,,,,,,,,,,,,,,,,,,,,,,,,,,,,,,,,,,,,,,,,,,,,,,,,,,,,,,,,,,,,,,,,,,,,,,,,,,,,,,,,,,,,,,,,,,,,,,,,,,,,,,,,,,,,,,,,,,,,,,,,,,,,,,,,,,,,,,,,,,,,,,,,,,,,,,,,,,,,,,,,,,,,,,,,,,,,,,,,,,,,,,,,,,,,,,,,,,,,,,,,,,,,,,,,,,,,,,,,,
